{
  "schema_version": 1,
  "evidence_kind": "blinded-measurement",
  "fixture": "agent-skill-maintainer-eval-binding-heldout-v37",
  "evaluation_input_sha256": "b40ff954727298eb659599ccce0a8213e7f4e0c5a998dc5c1826879790f68c06",
  "measured_at": "2026-07-30T10:27:56.243Z",
  "labels": {
    "a": {
      "output_sha256": "437c22d60983da4de3464c8ba02e90842f835bd377b6161604f9a03e249ff2c6",
      "events_sha256": "b4f395fccbd55d29ba48b5ef714d27c929d89bf1aadfb0e2a3f0170f83957f7b",
      "artifact_bytes": 40418,
      "tool_calls": 34,
      "session_nonce": "019fb28b-5cb6-7fd0-b3c9-e2e73ef149a8",
      "tool_sequence_sha256": "f30ad33069c936711371520ce141875086625e4f31331769558ce74e97287925",
      "heading_count": 0
    },
    "b": {
      "output_sha256": "3dba785c57c7abef5cd48e79b27d30ae29b56848c086e8c3b2a91f00ca10019d",
      "events_sha256": "ada30efd08c6f00e4b1c32297d4e779d4e3816ab0e4eb0f9df8972d39ee514a9",
      "artifact_bytes": 36356,
      "tool_calls": 25,
      "session_nonce": "019fb28b-5ca1-7731-b7ab-514e62e8be74",
      "tool_sequence_sha256": "1313f12b864c89424306f7201e35f90ffe093993aaffa77e1d5e95eb6ebcb1a5",
      "heading_count": 0
    }
  },
  "derivation": {
    "builder": "agent-skill-maintainer/blinded-measurement-v1",
    "encoding": "utf8",
    "tool_event_type": "codex-jsonl-complete-session",
    "heading_rule": "markdown-atx"
  },
  "raw_inputs_published": false,
  "synthetic_fixture": true
}
